{
  "schema_version": 1,
  "command": ["./host", "./a/libsame.so", "./b/libsame.so", "./consumer.so", "normal"],
  "working_directory": "../build/fixtures",
  "environment": {},
  "deadline": "5s",
  "limits": {"stdout_bytes": 4096, "stderr_bytes": 4096, "trace_bytes": 1048576},
  "roots": {"fixtures": "../build/fixtures"},
  "objects": {
    "host": {"root": "fixtures", "path": "host"},
    "consumer": {"root": "fixtures", "path": "consumer.so"},
    "a": {"root": "fixtures", "path": "a/libsame.so"},
    "b": {"root": "fixtures", "path": "b/libsame.so"}
  },
  "selectors": [
    {"reference": "consumer", "symbol": "shared_value", "trace_version": "", "providers": ["a"], "required": true}
  ]
}
